{
  "$schema": "./schemas/opening.schema.json",
  "start": "VILLAGE_HOME",
  "npcs": [
    {
      "id": "AD",
      "name": "阿德",
      "role": "村长",
      "description": "熟悉晨露村每一条小路，谈起年轻时的远行总会多说几句。比起催人出发，他更在意行囊是否准备妥当。",
      "services": [],
      "greeting": "来了？坐一会儿，出发的事可以慢慢说。"
    },
    {
      "id": "BRUNO",
      "name": "布鲁诺",
      "role": "武器匠",
      "description": "每天开店前都会检查柜台上的刀刃和绑带。他相信一件趁手的装备，应当让初次远行的人也用得安心。",
      "services": [
        "SHOP"
      ],
      "greeting": "看看有没有趁手的，绑带松了也可以找我。"
    },
    {
      "id": "MESHA",
      "name": "梅莎",
      "role": "幻兽护理员",
      "description": "能从脚步声辨认常来的幻兽。她总是先安抚紧张的伙伴，再耐心检查伤处。",
      "services": [
        "RECOVERY",
        "STORAGE",
        "RESEARCH_FOLLOWUP"
      ],
      "greeting": "先让伙伴歇歇，哪里不舒服都可以告诉我。"
    },
    {
      "id": "TERLIN",
      "name": "特林",
      "role": "庆典筹办人",
      "description": "随身带着写满事项的小册子，忙碌时也不忘招呼路过的邻居。让大家平安热闹地过节，是他最在意的事。",
      "services": [],
      "greeting": "来得正好！今天广场上的事可不少。"
    },
    {
      "id": "KLEIN",
      "name": "克林",
      "role": "学院接待员",
      "description": "把新生写错的表格整齐收在一旁，从不因此责备谁。他会逐项解释手续，让第一次来学院的人也能找到方向。",
      "services": [],
      "greeting": "欢迎来到诺姆学院。我们一项一项来，不着急。"
    },
    {
      "id": "FEYN",
      "name": "费恩",
      "role": "实践课导师",
      "description": "喜欢先听学生说完观察，再提出一个恰到好处的问题。他认为亲手尝试留下的印象，比背熟答案更长久。",
      "services": [
        "ACADEMY",
        "WORKSHOP"
      ],
      "greeting": "先说说你看到了什么，再想想为什么。"
    },
    {
      "id": "MILA",
      "name": "米菈",
      "role": "冒险指导员",
      "description": "善于把复杂的准备工作拆成几件小事。遇到犹豫的新手，她会先陪对方确认下一步能做什么。",
      "services": [],
      "greeting": "准备好下一步了吗？我们一起检查一下。"
    },
    {
      "id": "TRAVEL_MERCHANT",
      "name": "旅行商人",
      "role": "行商",
      "description": "行囊上挂着沿途收来的小饰物。谈起道路和天气，他往往比谈价钱更起劲。",
      "services": [],
      "greeting": "路上还顺利吗？前面的路标可别错过。"
    },
    {
      "id": "STATION_KEEPER",
      "name": "小站看护人",
      "role": "歇脚处看护人",
      "description": "每天清晨先扫净门前的落叶，再为旅人备好座位。谁在哪段路上需要帮助，他总记得清楚。",
      "services": [],
      "greeting": "歇歇脚吧，赶路的人也该照顾好伙伴。"
    },
    {
      "id": "FOREST_GUIDE",
      "name": "林口引路人",
      "role": "林地向导",
      "description": "习惯停下来辨认风声里的细小动静。出发前，他总会提醒旅人给林中的幻兽留下足够的空间。",
      "services": [],
      "greeting": "进林子前先听一听，风里有不少消息。"
    },
    {
      "id": "ROWAN",
      "name": "罗温",
      "role": "杂货铺店主",
      "description": "重新整理货架时，会把老顾客习惯买的东西放回原处。他希望店门再开时，街坊仍能找到熟悉的便利。",
      "services": [
        "SHOP"
      ],
      "greeting": "欢迎进店，缺什么尽管告诉我。"
    },
    {
      "id": "OUTBOUND_TRAVELER",
      "name": "准备出城的旅人",
      "role": "旅人",
      "description": "正仔细检查行囊的扣带，时不时望向城门外。他愿意和同行的人交换路上的消息。",
      "services": [],
      "greeting": "我正要出城，你也在准备行李吗？"
    },
    {
      "id": "RETURNING_TRAVELER",
      "name": "归来的旅人",
      "role": "旅人",
      "description": "鞋边还带着城外的泥土，脸上却是回到熟悉地方的轻松。一路遇到的新鲜事足够他说上一阵。",
      "services": [],
      "greeting": "终于回来了！这趟路上倒有些新发现。"
    },
    {
      "id": "CITY_COURIER",
      "name": "本地送货人",
      "role": "送货人",
      "description": "对街巷里的门牌熟得很，货包也总按路线扎得整齐。遇见挡路的小幻兽时，他宁愿多等一会儿。",
      "services": [],
      "greeting": "借过一下——不赶时间的话，我们聊两句？"
    },
    {
      "id": "RIVER_MERCHANT",
      "name": "河口供货商",
      "role": "河口供货商",
      "description": "一边核对货单，一边留意河上的风向。他清楚一件货物准时送达，背后需要多少人的照应。",
      "services": [],
      "greeting": "货物和道路都要看仔细，省得途中再折返。"
    },
    {
      "id": "ROWAN_RECEIVER",
      "name": "试送收货人",
      "role": "收货人",
      "description": "验货时会把包装重新叠好，连一根松动的系绳也记在单上。他认真留下的意见，常能省去下一趟的麻烦。",
      "services": [],
      "greeting": "包裹先放稳，我们一起核对。"
    },
    {
      "id": "SHALIN",
      "name": "莎琳",
      "role": "码头事务员",
      "description": "记录潮时与船期的本子从不离身。她欢迎初次出海的人，也会坚持让每个人先把安全检查做完。",
      "services": [
        "RECOVERY",
        "RESEARCH_FOLLOWUP"
      ],
      "greeting": "海风不错，不过出航前的检查一项也不能省。"
    },
    {
      "id": "SHIPWRIGHT",
      "name": "船坞木匠",
      "role": "修船匠",
      "description": "用指节轻敲木板就能听出哪里不对。修补旧船时，他总尽量保留那些经得住风浪的老部件。",
      "services": [],
      "greeting": "好木料得用在合适的地方，你来看这道纹理。"
    },
    {
      "id": "GARDEN_KEEPER",
      "name": "园圃照看人",
      "role": "园圃照看人",
      "description": "按日期记录花期、雨水和来访的幻兽。即使花开得比往年早，她也会先多观察几天再下结论。",
      "services": [],
      "greeting": "今天的花又有些变化，一起看看记录吧。"
    },
    {
      "id": "VILLAGE_SUPPLIER",
      "name": "杂货铺掌柜",
      "role": "村中商人",
      "description": "熟悉村民远行时最容易漏带的东西，装好货物后总会再提醒一句。",
      "services": [
        "SHOP"
      ],
      "greeting": "药品和封印球都在这边，出门前数一数吧。"
    },
    {
      "id": "ACADEMY_SUPPLIER",
      "name": "学院补给员",
      "role": "补给管理员",
      "description": "把常用的药剂和封印球分格摆好，方便上课前匆忙赶来的学生。",
      "services": [
        "SHOP"
      ],
      "greeting": "上课要用的东西准备齐了吗？"
    },
    {
      "id": "ACADEMY_CARER",
      "name": "学院护理员",
      "role": "幻兽护理员",
      "description": "课间会留意回来的每一队伙伴，提醒学生先照顾伤势，再讨论练习的得失。",
      "services": [
        "RECOVERY",
        "STORAGE",
        "WORKSHOP",
        "RESEARCH_FOLLOWUP"
      ],
      "greeting": "练习辛苦了，先让伙伴缓过来。"
    },
    {
      "id": "CITY_SHOPKEEPER",
      "name": "诺姆商店掌柜",
      "role": "商店掌柜",
      "description": "对柜台上的货品如数家珍，也乐意解释初来城中的旅人不熟悉的用法。",
      "services": [
        "SHOP",
        "ENHANCEMENT",
        "MARKET"
      ],
      "greeting": "需要补给还是整理装备？慢慢挑。"
    },
    {
      "id": "CITY_RESEARCHER",
      "name": "诺姆护理师",
      "role": "护理与研究员",
      "description": "把照护记录整理得十分仔细，希望从日常变化里更好地理解幻兽的成长。",
      "services": [
        "RECOVERY",
        "STORAGE",
        "RESEARCH"
      ],
      "greeting": "伙伴最近有什么变化？照护记录最能说明问题。"
    },
    {
      "id": "CITY_RECRUITER",
      "name": "冒险委托员",
      "role": "组队接待员",
      "description": "认真核对每支队伍的准备情况，最常说的话是出发前再互相确认一次。",
      "services": [
        "DUNGEON"
      ],
      "greeting": "想找同行的伙伴吗？出发前先把准备说清楚。"
    },
    {
      "id": "FOREST_RECRUITER",
      "name": "兽栏联络员",
      "role": "入口接待员",
      "description": "在旧牧场外核对队伍名单，提醒每位队员检查补给与伙伴。",
      "services": [
        "DUNGEON"
      ],
      "greeting": "伙伴都到齐了吗？确认准备后，我们再一起进去。"
    }
  ],
  "safeReturns": [
    {
      "location": "UNDINE_WHARF",
      "requires": "QUEST:BQ057",
      "fromLocations": [
        "UNDINE_BUOY_ONE",
        "UNDINE_BUOY_TWO",
        "UNDINE_BAY"
      ]
    },
    {
      "location": "GNOME_CITY",
      "requires": "QUEST:BQ029"
    },
    {
      "location": "ACADEMY",
      "requires": "QUEST:BQ016"
    },
    {
      "location": "SQUARE"
    }
  ],
  "professions": [
    {
      "id": "WARRIOR",
      "name": "战士",
      "description": "近战与保护"
    },
    {
      "id": "MAGE",
      "name": "法师",
      "description": "法术与元素"
    },
    {
      "id": "PRIEST",
      "name": "牧师",
      "description": "治疗与支援"
    },
    {
      "id": "RANGER",
      "name": "游侠",
      "description": "远程与机动"
    }
  ],
  "places": [
    {
      "id": "VILLAGE_HOME",
      "name": "晨露村家门",
      "description": "庆典筹备的声音从广场传来，沿石板路出门，去看看今天有什么能帮上忙的事。",
      "x": 0,
      "y": 0,
      "exits": [
        "STONE_PATH"
      ]
    },
    {
      "id": "FOREST_EDGE",
      "name": "东侧林口",
      "description": "河边的小路延伸进树林，运送庆典食材的货车停在林口。前方窄路贴着山洞延伸，引路人正照看退到安全处的车夫。",
      "npcs": [
        {
          "npcId": "FOREST_GUIDE"
        }
      ],
      "x": 1,
      "y": 3,
      "requiredFacts": [
        "QUEST:BQ009"
      ],
      "exits": [
        "RIVERSIDE",
        "CAVE_ENTRANCE",
        "PLAIN_SIGN"
      ]
    },
    {
      "id": "CAVE_ENTRANCE",
      "name": "山洞入口",
      "description": "运货的窄路贴着洞口延伸，岩壁上留着巨大的爪痕。这里也是獠牙兽王的巢域，滞留的车夫正等着道路恢复通行。",
      "x": 2,
      "y": 3,
      "requiredFacts": [
        "QUEST:BQ010"
      ],
      "exits": [
        "FOREST_EDGE"
      ]
    },
    {
      "id": "STONE_PATH",
      "name": "石板路",
      "description": "踏上斑驳的石板，前方是村中广场，另一边传来流水声。",
      "x": 1,
      "y": 0,
      "exits": [
        "VILLAGE_HOME",
        "SQUARE",
        "RIVERSIDE"
      ]
    },
    {
      "id": "RIVERSIDE",
      "name": "河边小路",
      "description": "河水在岸边轻轻拍打，沿原路可以回到石板路。",
      "x": 2,
      "y": 0,
      "exits": [
        "STONE_PATH",
        "FOREST_EDGE"
      ]
    },
    {
      "id": "ELDER_HOUSE",
      "name": "村长家",
      "description": "木门旁挂着一盏灯，村长正在屋内等候。",
      "npcs": [
        {
          "npcId": "AD"
        }
      ],
      "x": 0,
      "y": 1,
      "exits": [
        "SQUARE"
      ]
    },
    {
      "id": "SQUARE",
      "name": "村中广场",
      "description": "道路在这里交汇，村民们忙着布置庆典，长桌旁传来熟悉的招呼声。",
      "npcs": [
        {
          "npcId": "TERLIN"
        }
      ],
      "x": 1,
      "y": 1,
      "exits": [
        "STONE_PATH",
        "ELDER_HOUSE",
        "WEAPON_SHOP",
        "PET_CENTER",
        "SUPPLY_SHOP"
      ]
    },
    {
      "id": "WEAPON_SHOP",
      "name": "武器店",
      "description": "店内摆着整齐的武器架，铁锤声从后院传来。",
      "npcs": [
        {
          "npcId": "BRUNO"
        }
      ],
      "x": 2,
      "y": 1,
      "exits": [
        "SQUARE"
      ]
    },
    {
      "id": "PET_CENTER",
      "services": [
        "RECOVERY",
        "STORAGE"
      ],
      "name": "幻兽中心",
      "description": "这里照料着村里的幻兽伙伴。",
      "npcs": [
        {
          "npcId": "MESHA"
        }
      ],
      "x": 0,
      "y": 2,
      "exits": [
        "SQUARE"
      ]
    },
    {
      "id": "SUPPLY_SHOP",
      "services": [
        "SUPPLIES"
      ],
      "name": "杂货铺",
      "description": "药瓶与封印球陈列在柜台后。",
      "x": 2,
      "y": 2,
      "exits": [
        "SQUARE"
      ],
      "npcs": [
        {
          "npcId": "VILLAGE_SUPPLIER"
        }
      ]
    },
    {
      "id": "PLAIN_SIGN",
      "name": "平原路标",
      "description": "路标指向诺姆小站，草地上留着凌乱的足迹。",
      "npcs": [
        {
          "npcId": "TRAVEL_MERCHANT"
        }
      ],
      "x": 1,
      "y": 4,
      "requiredFacts": [
        "QUEST:BQ014"
      ],
      "exits": [
        "FOREST_EDGE",
        "STATION_OUTSKIRTS"
      ]
    },
    {
      "id": "STATION_OUTSKIRTS",
      "name": "小站歇脚处",